{
  "protocol_id": "kitchen-sink",
  "name": "Kitchen Sink",
  "snapshot_id": "unpinned",
  "chains": [
    "ethereum"
  ],
  "subsystems": [
    "defi-vault",
    "bridge"
  ],
  "contracts": [
    {
      "name": "Vault",
      "path": "src/Vault.sol",
      "role": "core",
      "in_scope": true,
      "entry_points": [
        "deposit",
        "withdraw",
        "mint"
      ],
      "state_variables": [
        {
          "name": "totalAssets",
          "kind": "balance",
          "accounting": true
        },
        {
          "name": "totalSupply",
          "kind": "share",
          "accounting": true
        },
        {
          "name": "paused",
          "kind": "flag",
          "accounting": false
        }
      ]
    },
    {
      "name": "Oracle",
      "path": "src/Oracle.sol",
      "role": "oracle",
      "in_scope": true
    }
  ],
  "actors": [
    {
      "id": "governor",
      "kind": "ROLE",
      "trust": "trusted",
      "can_drain": true,
      "can_upgrade": true,
      "can_pause": true
    },
    {
      "id": "user",
      "kind": "EOA",
      "trust": "externally-owned"
    },
    {
      "id": "keeper",
      "kind": "KEEPER",
      "trust": "semi-trusted",
      "can_drain": false
    }
  ],
  "assets": [
    {
      "id": "share",
      "kind": "share",
      "erc": "4626",
      "decimals": 18
    },
    {
      "id": "debt",
      "kind": "debt",
      "decimals": 18
    },
    {
      "id": "FEE",
      "kind": "token",
      "decimals": 7,
      "fee_on_transfer": true
    },
    {
      "id": "REB",
      "kind": "token",
      "decimals": 8,
      "rebasing": true
    },
    {
      "id": "ERC777",
      "kind": "token",
      "decimals": 6,
      "erc": "777"
    },
    {
      "id": "USDC",
      "kind": "token",
      "decimals": 6
    },
    {
      "id": "WEIRD",
      "kind": "lp",
      "decimals": 12,
      "nonstandard_behaviors": [
        "hooks-on-transfer",
        "self-destruct"
      ]
    }
  ],
  "liabilities": [
    {
      "id": "user-deposits",
      "description": "deposits owed to users",
      "counterparty": "user",
      "bounded": false
    }
  ],
  "privileges": [
    {
      "role": "governor",
      "capability": "upgrade implementation",
      "mechanism": "proxy admin",
      "timelocked": true,
      "can_drain": false
    },
    {
      "role": "governor",
      "capability": "pause vault",
      "mechanism": "pause()",
      "timelocked": false
    },
    {
      "role": "keeper",
      "capability": "liquidate position",
      "mechanism": "liquidate()"
    },
    {
      "role": "bridge-admin",
      "capability": "relay message",
      "mechanism": "messenger"
    },
    {
      "role": "bridge-admin",
      "capability": "relay message",
      "mechanism": "messenger"
    }
  ],
  "trust_boundaries": [
    {
      "from": "user",
      "to": "Vault",
      "crossing": "user-supplied token",
      "validated": false
    },
    {
      "from": "Vault",
      "to": "Oracle",
      "crossing": "price feed",
      "validated": true
    },
    {
      "from": "Vault",
      "to": "Bridge",
      "crossing": "message",
      "validated": false
    }
  ],
  "relations": [
    {
      "from": "user",
      "rel": "DEPOSITS",
      "to": "Vault",
      "via": "deposit()"
    },
    {
      "from": "Vault",
      "rel": "MINTS",
      "to": "share",
      "via": "deposit()"
    },
    {
      "from": "Vault",
      "rel": "BURNS",
      "to": "share",
      "via": "withdraw()"
    },
    {
      "from": "Vault",
      "rel": "WITHDRAWS",
      "to": "USDC",
      "via": "withdraw()"
    },
    {
      "from": "Vault",
      "rel": "BORROWS",
      "to": "debt",
      "via": "borrow()"
    },
    {
      "from": "Vault",
      "rel": "LIQUIDATES",
      "to": "debt",
      "via": "liquidate()"
    },
    {
      "from": "governor",
      "rel": "UPGRADES",
      "to": "Vault",
      "via": "proxy admin"
    },
    {
      "from": "Vault",
      "rel": "BRIDGES",
      "to": "Bridge",
      "via": "send()"
    },
    {
      "from": "Vault",
      "rel": "CALLS",
      "to": "Oracle",
      "via": "latestAnswer()"
    },
    {
      "from": "Vault",
      "rel": "PRICES",
      "to": "Oracle",
      "via": "latestAnswer()"
    },
    {
      "from": "Vault",
      "rel": "DEPENDS_ON",
      "to": "Oracle"
    },
    {
      "from": "user",
      "rel": "OWNS",
      "to": "share"
    }
  ],
  "state_machines": [
    {
      "name": "vault-lifecycle",
      "states": [
        {
          "id": "active"
        },
        {
          "id": "paused"
        },
        {
          "id": "closed",
          "terminal": true
        }
      ],
      "transitions": [
        {
          "from": "active",
          "to": "paused",
          "trigger": "pause()",
          "actor": "governor"
        }
      ],
      "suspect_properties": [
        "unpause without delay"
      ]
    }
  ],
  "economic_relations": [
    {
      "id": "EQ-001",
      "equation": "shares * price == total_assets",
      "meaning": "share price invariant",
      "variables": [
        "shares",
        "price",
        "total_assets"
      ],
      "enforced_by": [
        "Vault.sharePrice()"
      ],
      "breakable_by": [
        "donation-attack"
      ]
    }
  ],
  "invariants": [
    {
      "id": "INV-001",
      "statement": "shares are fully backed",
      "applies_to": [
        "Vault"
      ],
      "kind": "economic",
      "severity_if_broken": "critical"
    }
  ],
  "oracles": [
    {
      "id": "ORC-1",
      "kind": "chainlink",
      "feeds": [
        "ETH/USD"
      ],
      "staleness_guard": true,
      "deviation_guard": false,
      "manipulable_by": "none"
    },
    {
      "id": "ORC-2",
      "kind": "spot-amm",
      "feeds": [
        "USDC/ETH"
      ],
      "staleness_guard": false,
      "manipulable_by": "flash loan"
    }
  ],
  "upgrade_paths": [
    {
      "mechanism": "uups",
      "admin": "governor",
      "initializer": "initialize"
    }
  ],
  "open_questions": [
    {
      "question": "who owns the bridge?"
    }
  ]
}
