{
 "protocol_id": "acme-vault",
 "name": "Acme Vault",
 "snapshot_id": "unpinned",
 "chains": [
  "ethereum"
 ],
 "subsystems": [
  "defi-vault"
 ],
 "contracts": [
  {
   "name": "Vault",
   "path": "src/Vault.sol",
   "role": "core",
   "in_scope": true,
   "entry_points": [
    "deposit",
    "withdraw"
   ],
   "state_variables": [
    {
     "name": "totalAssets",
     "kind": "balance",
     "accounting": true
    },
    {
     "name": "balanceOf",
     "kind": "mapping-balance",
     "accounting": true
    }
   ]
  },
  {
   "name": "VaultProxy",
   "path": "src/VaultProxy.sol",
   "role": "proxy",
   "in_scope": false
  }
 ],
 "actors": [
  {
   "id": "governor",
   "kind": "ROLE",
   "trust": "trusted",
   "can_drain": true,
   "can_upgrade": true,
   "can_pause": true
  },
  {
   "id": "user",
   "kind": "EOA",
   "trust": "externally-owned"
  }
 ],
 "assets": [
  {
   "id": "share",
   "kind": "share",
   "erc": "4626",
   "decimals": 18
  },
  {
   "id": "USDC",
   "kind": "token",
   "decimals": 6,
   "nonstandard_behaviors": [
    "fee-on-transfer"
   ]
  }
 ],
 "liabilities": [
  {
   "id": "user-deposits",
   "description": "deposits owed to users",
   "counterparty": "user",
   "bounded": false
  }
 ],
 "privileges": [
  {
   "role": "Governor",
   "capability": "upgrade implementation",
   "mechanism": "proxy admin",
   "timelocked": true,
   "multisig_threshold": 3,
   "can_drain": false
  },
  {
   "role": "governor",
   "capability": "pause vault",
   "mechanism": "modifier",
   "timelocked": false,
   "can_drain": false
  },
  {
   "role": "guardian",
   "capability": "rescue stranded funds",
   "mechanism": "AccessControl ROLE_RESCUER"
  }
 ],
 "trust_boundaries": [
  {
   "from": "user",
   "to": "Vault",
   "crossing": "user-supplied token",
   "validated": false
  }
 ],
 "relations": [
  {
   "from": "user",
   "rel": "DEPOSITS",
   "to": "Vault",
   "via": "deposit()"
  },
  {
   "from": "Vault",
   "rel": "MINTS",
   "to": "share",
   "via": "deposit()"
  }
 ],
 "state_machines": [],
 "economic_relations": [],
 "invariants": [
  {
   "id": "INV-001",
   "statement": "share redeem value is fully backed by vault assets",
   "applies_to": [
    "Vault"
   ],
   "kind": "economic",
   "severity_if_broken": "critical"
  }
 ],
 "oracles": [],
 "upgrade_paths": [
  {
   "mechanism": "uups",
   "admin": "governor",
   "initializer": "initialize"
  }
 ],
 "open_questions": [
  {
   "question": "is the proxy admin a timelock or an EOA?"
  }
 ]
}
